item,description,qty,unit,spec,first_source,alternates,tag,notes
E1-01,600 A track busway run (straight sections to make one run),8,run,"600 A continuous, 3-phase 4-wire + ground, 415/240 Vac Wye, UL 857 / IEC 61439-6, open-channel tap-off anywhere along run, hot-aisle overhead mount",Starline T5 600 A,"Vertiv PowerBar iMPB (Cu 600 A); Schneider Canalis KS",W,"Run length approx 46 ft nominal (4 bays x 121 in = 40.3 ft rack zone + end-feed stub) - total approx 368 ft. Footage is [W] until LAYOUT-01 layout drawing; quote per-foot plus per-section."
E1-02,End feed unit 600 A,8,ea,"600 A end feed with lug termination for contractor feeder conductors from RPP, matching busway series",Starline T5 end feed,per busway vendor,W,One per run. Feeder conductors and conduit by install contractor (excluded).
E1-03,End cap / closure,8,ea,Series end closure,per busway vendor,per busway vendor,W,One per run far end.
E1-04,Hanger / mounting kit,80,set,"Vendor standard drop/bracket kit suitable for mounting to HAC cross-aisle beams (HSS steel) per Deschutes 18.7 - placement fungible",per busway vendor,per busway vendor,W,"Est. 10 per run at approx 5 ft spacing. Weights feed ELE-OI-03 (LA-PE structural input, with HAC-OI-01)."
E1-05,Joint kits / couplers,40,ea,Series section-to-section joints as required for approx 10 ft sections,per busway vendor,per busway vendor,W,Quantity follows final section breakdown - vendor to confirm with layout.
